{"glovebox": "import", "version": 1, "kind": "service-history", "items": [{"date": "2024-03-01", "odometer": 41000, "work": [{"label": "Oil & filter change", "service": "oil"}], "doneBy": {"type": "diy"}}, {"date": "2024-03-01", "odometer": 41000, "work": [{"label": "Tire rotation", "service": "rotation"}], "doneBy": {"type": "diy"}}]}
